mysql> use books;
Database changed
mysql> select*from books;
+--------+------------+---------------+---------+
| bookno | bookname   | publishername | country |
+--------+------------+---------------+---------+
|      1 | Rustyy     | Rowling       | England |
|      2 | My name    | Sudhamurty    | india   |
|      3 | Bestfriend | Anand         | india   |
|      2 | Rich&poor  | prain         | Germany |
+--------+------------+---------------+---------+
4 rows in set (0.00 sec)

mysql> update books set bookno=4 where country='Germany';
Query OK, 1 row affected (0.00 sec)
Rows matched: 1  Changed: 1  Warnings: 0

mysql> update books set publishername ='wordsworth' where bookno=4;
Query OK, 1 row affected (0.00 sec)
Rows matched: 1  Changed: 1  Warnings: 0

mysql> select * from books;
+--------+------------+---------------+---------+
| bookno | bookname   | publishername | country |
+--------+------------+---------------+---------+
|      1 | Rustyy     | Rowling       | England |
|      2 | My name    | Sudhamurty    | india   |
|      3 | Bestfriend | Anand         | india   |
|      4 | Rich&poor  | wordsworth    | Germany |
+--------+------------+---------------+---------+
4 rows in set (0.00 sec)
